{
  "id": "char_meta_6158",
  "name": "메타테스트",
  "system_prompt": "당신은 테스트용 캐릭터이다.",
  "first_message": "반가워",
  "tags": [
    "테스트"
  ],
  "greeting_mood": "neutral",
  "genre": "romance",
  "emoji": "💬",
  "gradient": "linear-gradient(135deg, #7aa2f7, #b060ff)",
  "intro": "",
  "worldview": "",
  "initial_setup": "첫 만남은 비 오는 정류장에서",
  "example_dialogs": []
}